{
  "id": "00000000-0000-0000-0000-000000000102",
  "kind": "future_block_kind",
  "status": "ready",
  "revision": 1,
  "order_key": 2000,
  "tool_call_id": null,
  "parent_tool_call_id": null,
  "parent_block_id": null,
  "node_role": "timeline",
  "anchor": null,
  "payload": {"fallback_text": "未来 Block"},
  "created_at": "2026-08-25T02:00:01Z",
  "updated_at": "2026-08-25T02:00:02Z"
}
