{
  "id": "00000000-0000-0000-0000-000000000101",
  "kind": "text",
  "status": "streaming",
  "revision": 7,
  "order_key": 1000,
  "tool_call_id": null,
  "parent_tool_call_id": null,
  "parent_block_id": null,
  "node_role": "timeline",
  "anchor": null,
  "payload": {"text": "这项指标", "content_type": "text/markdown", "fallback_text": "这项指标"},
  "created_at": "2026-08-25T02:00:01Z",
  "updated_at": "2026-08-25T02:00:02Z"
}
